{
  "schemaVersion": 1,
  "id": "scott/deploy-shared-lightsail-vm",
  "version": "1.0.1",
  "displayName": "Deploy Shared Lightsail VM",
  "description": "Retired skill. Disabled pending removal; performs no behavior.",
  "files": [
    "SKILL.md"
  ],
  "targets": {
    "required": [
      {
        "harness": "codex",
        "os": "darwin",
        "profile": "default",
        "scope": "global"
      },
      {
        "harness": "codex",
        "os": "windows",
        "profile": "default",
        "scope": "global"
      },
      {
        "harness": "claude-code",
        "os": "darwin",
        "profile": "personal",
        "scope": "global"
      },
      {
        "harness": "claude-code",
        "os": "darwin",
        "profile": "organization",
        "scope": "global"
      },
      {
        "harness": "claude-code",
        "os": "windows",
        "profile": "personal",
        "scope": "global"
      },
      {
        "harness": "claude-code",
        "os": "windows",
        "profile": "organization",
        "scope": "global"
      },
      {
        "harness": "claude-desktop",
        "os": "darwin",
        "profile": "personal",
        "scope": "global"
      },
      {
        "harness": "claude-desktop",
        "os": "darwin",
        "profile": "organization",
        "scope": "global"
      },
      {
        "harness": "claude-desktop",
        "os": "windows",
        "profile": "personal",
        "scope": "global"
      },
      {
        "harness": "claude-desktop",
        "os": "windows",
        "profile": "organization",
        "scope": "global"
      }
    ]
  },
  "activation": "next-launch",
  "lifecycle": {
    "state": "removed",
    "graceDays": 0,
    "message": "Retired at the owner's request; merged into the local aws-vm skill.",
    "emergencyOverride": {
      "approvedBy": "Scott Smith (sesmith2k)",
      "reason": "Duplicate of the local aws-vm skill; merged into it",
      "approvedAt": "2026-10-01T18:00:08Z"
    }
  },
  "smokeTests": []
}
