{
  "schemaVersion": 1,
  "id": "scott/brainstorm",
  "version": "1.3.1",
  "displayName": "Brainstorm",
  "description": "Use when the user says \"brainstorm\", \"let's brainstorm\", \"help me think through this idea\", \"flesh out this idea\", \"interview me about\", or wants to explore an idea before building it. Runs a one-question-at-a-time interview, expands and pressure-tests the idea, and produces an actionable plan with acceptance criteria.",
  "files": [
    "SKILL.md",
    "references/coverage-lenses.md",
    "references/example-session.md",
    "references/goldfish.md",
    "references/package-research.md",
    "references/plan-document.md",
    "references/records.md",
    "references/second-opinion.md"
  ],
  "targets": {
    "required": [
      {
        "harness": "codex",
        "os": "darwin",
        "profile": "default",
        "scope": "global"
      },
      {
        "harness": "codex",
        "os": "windows",
        "profile": "default",
        "scope": "global"
      },
      {
        "harness": "claude-code",
        "os": "darwin",
        "profile": "personal",
        "scope": "global"
      },
      {
        "harness": "claude-code",
        "os": "darwin",
        "profile": "organization",
        "scope": "global"
      },
      {
        "harness": "claude-code",
        "os": "windows",
        "profile": "personal",
        "scope": "global"
      },
      {
        "harness": "claude-code",
        "os": "windows",
        "profile": "organization",
        "scope": "global"
      },
      {
        "harness": "claude-desktop",
        "os": "darwin",
        "profile": "personal",
        "scope": "global"
      },
      {
        "harness": "claude-desktop",
        "os": "darwin",
        "profile": "organization",
        "scope": "global"
      },
      {
        "harness": "claude-desktop",
        "os": "windows",
        "profile": "personal",
        "scope": "global"
      },
      {
        "harness": "claude-desktop",
        "os": "windows",
        "profile": "organization",
        "scope": "global"
      }
    ]
  },
  "activation": "next-launch",
  "smokeTests": [
    {
      "type": "file-contains",
      "path": "SKILL.md",
      "contains": "# Brainstorm a Plan"
    }
  ]
}
