{
  "schemaVersion": 1,
  "id": "scott/foreman",
  "version": "2.0.2",
  "displayName": "Foreman",
  "description": "Retired skill. Disabled pending removal; performs no behavior.",
  "files": [
    "SKILL.md"
  ],
  "targets": {
    "required": [
      {
        "harness": "codex",
        "os": "darwin",
        "profile": "default",
        "scope": "global"
      },
      {
        "harness": "codex",
        "os": "windows",
        "profile": "default",
        "scope": "global"
      },
      {
        "harness": "claude-code",
        "os": "darwin",
        "profile": "personal",
        "scope": "global"
      },
      {
        "harness": "claude-code",
        "os": "darwin",
        "profile": "organization",
        "scope": "global"
      },
      {
        "harness": "claude-code",
        "os": "windows",
        "profile": "personal",
        "scope": "global"
      },
      {
        "harness": "claude-code",
        "os": "windows",
        "profile": "organization",
        "scope": "global"
      },
      {
        "harness": "claude-desktop",
        "os": "darwin",
        "profile": "personal",
        "scope": "global"
      },
      {
        "harness": "claude-desktop",
        "os": "darwin",
        "profile": "organization",
        "scope": "global"
      },
      {
        "harness": "claude-desktop",
        "os": "windows",
        "profile": "personal",
        "scope": "global"
      },
      {
        "harness": "claude-desktop",
        "os": "windows",
        "profile": "organization",
        "scope": "global"
      }
    ]
  },
  "activation": "next-launch",
  "lifecycle": {
    "state": "removed",
    "graceDays": 0,
    "message": "Retired at the owner's request; the backing service is no longer used.",
    "emergencyOverride": {
      "approvedBy": "Scott Smith (sesmith2k)",
      "reason": "Grok/xAI subscription dropped; Foreman runs on Grok Bot and is retired",
      "approvedAt": "2026-10-01T17:47:45Z"
    }
  },
  "smokeTests": []
}
